,area,bathroom_num,bedroom_num,city,desc,dev_name,floor_count,floor_num,furnishing,id,id_string,latitude,locality,longitude,post_date,poster_name,price,project,title,trans,type,url,user_type
20699,1000.0,2.0,2,Mumbai,"2 Bath,Semi-Furnished,10 floor,North - East facing Exclusive garden facing 2bhk higher floor with modular kitchen,. Acs and 1 covered car parking available for immediate rental basis at one of the most luxurious complex in powai. The complex has all modern amenities like swimming pool gym garden children play area. call for more details.",L&T Realty,24.0,10.0,Semi-Furnished,47049073,domcache_srp_47049073,19.122307,Powai,72.89599270000002,2020-01-01,Dinesh,55000,Emerald Isle," 2 BHK Apartment for Rent in Emerald Isle, Powai 1000 sqft",Rent,Apartment,/propertyDetails/2-BHK-1000-Sq-ft-Multistorey-Apartment-FOR-Rent-Powai-in-Mumbai&id=4d423437303439303733,Agent
20733,1000.0,2.0,2,Mumbai,"2 Bath,Unfurnished,12 floor,East facing Prime LocationHigher floorSpacious flatAll amenitiesKeys AvailableGreat viewGated communitySchools & colleges at walking distanceMalls Hospitals hotels restaurants nearby",Rustomjee,19.0,12.0,Unfurnished,46850995,domcache_srp_46850995,19.173714687910604,Goregaon West,72.8409863148874,2019-12-21,Dhruvin  Shah,55000,Rustomjee Ozone," 2 BHK Apartment for Rent in Rustomjee Ozone, Goregaon West 1000 sqft",Rent,Apartment,/propertyDetails/2-BHK-1000-Sq-ft-Multistorey-Apartment-FOR-Rent-Goregaon-West-in-Mumbai&id=4d423436383530393935,Agent
20749,1000.0,2.0,2,Mumbai,"2 Bath,Furnished,4 floor,South - East facing 2 BHK Fully Furnished Luxury Flat is Avilable for RENT with 1 Car Park at Bhakti Park Near IMAX BIG CINEMA, Wadala very well building is in a peaceful good locality and surrounding from affluent area having with all ultra modern amenities like, beautiful kitchen, rain water storage, security, 24 hours water supply, play area for children and water treatment. Please feel free to call us for any queries, details or site visit.",Ajmera Group,7.0,4.0,Furnished,41341541,domcache_srp_41341541,19.02935005594641,Bhakti Park,72.88030444699154,2020-01-09,Balwinder Singh Banga,51000,Ajmera Bhakti Park," 2 BHK Apartment for Rent in Ajmera Bhakti Park, Bhakti Park 1000 sqft",Rent,Apartment,/propertyDetails/2-BHK-1000-Sq-ft-Multistorey-Apartment-FOR-Rent-Bhakti-Park-in-Mumbai-r2&id=4d423431333431353431,Agent
20767,1000.0,2.0,2,Mumbai,"2 Bath,Semi-Furnished,14 floor,East facing This spacious 2 Bedroom Flat is situated on 14th floor and it has 2 bathroom You can get this Flat at 55000 per month.",Nahar Group,20.0,14.0,Semi-Furnished,42939835,domcache_srp_42939835,19.1064822,Powai,72.9003577,2020-01-14,Nisha Nair,55000,Nahar Jonquille and Jamaica," 2 BHK Apartment for Rent in Nahar Jonquille and Jamaica, Powai 1000 sqft",Rent,Apartment,/propertyDetails/2-BHK-1000-Sq-ft-Multistorey-Apartment-FOR-Rent-Powai-in-Mumbai&id=4d423432393339383335,Agent
20781,1000.0,2.0,2,Mumbai,"2 Bath,Furnished,5 floor,East facing 2 Bhk, Well Done up fully furnished apartment available for rent in Vaibhav paradise. The Building is located at a peaceful location on Aaram Society road. Amenities like Swimming Pool on the terrace, gym, play area for kids & Good security with CCTV cameras available all over the society premises. Ideal for famileis working in BKC, Lower parel & nearby areas. The apartment comes with one reserved car parking space in the society premises. Do give us a call with your requirement and we will be happy to help you.",Vaibhav properties,12.0,5.0,Furnished,45721823,domcache_srp_45721823,19.076730800000004,Vakola,72.85426650000002,2019-12-16,Krishna  Devadiga,62000,Vaibhav Paradise," 2 BHK Apartment for Rent in Vaibhav Paradise, Vakola 1000 sqft",Rent,Apartment,/propertyDetails/2-BHK-1000-Sq-ft-Multistorey-Apartment-FOR-Rent-Vakola-in-Mumbai&id=4d423435373231383233,Agent
20822,1000.0,2.0,2,Mumbai,"2 Bath,Furnished,6 floor,East facing this property is prime location near by each and every thing plz c. more enquiry 9768233649/8655071433",HCBS Developer,15.0,6.0,Furnished,34524453,domcache_srp_34524453,19.1416655,Andheri West,72.83453134,2020-01-07,Govind  Gupta,56000,Dheeraj Gaurav Heights," 2 BHK Apartment for Rent in Dheeraj Gaurav Heights, Andheri West 1000 sqft",Rent,Apartment,/propertyDetails/2-BHK-1000-Sq-ft-Multistorey-Apartment-FOR-Rent-Andheri-West-in-Mumbai-r6&id=4d423334353234343533,Agent
20858,1000.0,2.0,2,Mumbai,"2 Bath,Semi-Furnished,5 floor,North - East facing Our fees only Rs. 20,000 for an apartment in Mumbai. Professional Property Management. Multiple direct options available. There is 2bhk apartment available.",H K Pujara Builders,13.0,5.0,Semi-Furnished,46654675,domcache_srp_46654675,19.13605492,Andheri West,72.83612939,2019-12-12,Azuro,55000,Chitralekha HERRITAGE," 2 BHK Apartment for Rent in Chitralekha HERRITAGE, Andheri West 1000 sqft",Rent,Apartment,/propertyDetails/2-BHK-1000-Sq-ft-Multistorey-Apartment-FOR-Rent-Andheri-West-in-Mumbai&id=4d423436363534363735,Agent
20877,1000.0,2.0,2,Mumbai,"2 Bath,Unfurnished,10 floor,East facing which is a very good society. The space is semifurnished, located on 8th floor of 12 floors. It has 2 bedrooms, 2 bathrooms. The flat is built on the principles of feng-shui/vaastu. It is an ideal accommodation for all and has a super built-up area of 1100 Sq. Ft. It",L&T Realty,23.0,10.0,Unfurnished,47199335,domcache_srp_47199335,19.1213965,Powai,72.8908437,2020-01-14,Vaibhav  Lahane,54000,Emerald Isle Phase 2," 2 BHK Apartment for Rent in Emerald Isle Phase 2, Powai 1000 sqft",Rent,Apartment,/propertyDetails/2-BHK-1000-Sq-ft-Multistorey-Apartment-FOR-Rent-Powai-in-Mumbai&id=4d423437313939333335,Agent
20935,1000.0,2.0,2,Mumbai,"2 Bath,Unfurnished,11 floor,West facing Prime LocationHigher floorSpacious flatAll amenitiesKeys AvailableGreat viewGated communitySchools & colleges at walking distanceMalls Hospitals hotels restaurants nearby",Rustomjee,36.0,11.0,Unfurnished,46826285,domcache_srp_46826285,19.17450806,Mindspace,72.83458096,2019-12-20,Dhruvin  Shah,52000,Rustomjee Elanza," 2 BHK Apartment for Rent in Rustomjee Elanza, Mindspace 1000 sqft",Rent,Apartment,/propertyDetails/2-BHK-1000-Sq-ft-Multistorey-Apartment-FOR-Rent-Mindspace-in-Mumbai&id=4d423436383236323835,Agent
20938,1000.0,2.0,2,Mumbai,"2 Bath,Furnished,6 floor  This property includes 2 bathrooms and 2 stylish This is a 2 AC, 2 Bed, 2 Wardrobe, 1 TV, Fridge, Sofa, Washing Machine, Dining Table, Gas Connection, Microwave Home. The society offers None lifts for residents in a tower. In this society there is No/Rare Powercut 24 Hours Available water supply. It offers additional Store for tenants. ",Cooperative Group Housing Society,7.0,6.0,Furnished,46063439,domcache_srp_46063439,0.0,Andheri West,0.0,2019-11-15,Dharmesh,56000,Andheri CHS," 2 BHK Apartment for Rent in Andheri CHS, Andheri West 1000 sqft",Rent,Apartment,/propertyDetails/2-BHK-1000-Sq-ft-Multistorey-Apartment-FOR-Rent-Andheri-West-in-Mumbai&id=4d423436303633343339,Agent
20967,1000.0,2.0,2,Mumbai,"2 Bath,Semi-Furnished,4 floor,East facing no noise area",Hiranandani Group,7.0,4.0,Semi-Furnished,46918527,domcache_srp_46918527,19.1179513,Powai,72.909637,2019-12-24,Sagar  Gawai,59000,Hiranandani Gardens Golden Oak," 2 BHK Apartment for Rent in Hiranandani Gardens Golden Oak, Powai 1000 sqft",Rent,Apartment,/propertyDetails/2-BHK-1000-Sq-ft-Multistorey-Apartment-FOR-Rent-Powai-in-Mumbai&id=4d423436393138353237,Agent
20975,1000.0,2.0,2,Mumbai,"2 Bath,Semi-Furnished,4 floor,East facing The Flat has 2 bedroom and it is on 4th floor and offers 2 bathroom You can rent this beautiful flat on a monthly rent of 52000.",Morya Group,7.0,4.0,Semi-Furnished,45571147,domcache_srp_45571147,19.0774349,Santacruz East,72.84196390000002,2019-11-19,Krishna  Devadiga,52000,Morya Crystal," 2 BHK Apartment for Rent in Morya Crystal, Santacruz East 1000 sqft",Rent,Apartment,/propertyDetails/2-BHK-1000-Sq-ft-Multistorey-Apartment-FOR-Rent-Santacruz-East-in-Mumbai&id=4d423435353731313437,Agent
21032,1000.0,2.0,2,Mumbai,"2 Bath,Unfurnished,14 floor,East facing Un furnished 2 bhk flat for rent in Lake Pleasant at Lake Homes Powai. Multistory apartment is available for rent .24 hrs water facility, Gym Swimming Pool & power back up with car parking, lift & good Security & for the complete family. Close proximity to dmart & the international domestic airport. Easy connectivity western & eastern express highway. Nice peacefully locality and very convenient close to station, school, and collage. The property is well structured and has been made with the highest standard reasonable price apartment in Mumbai, very well done up. Best price available.",Supreme Universal,22.0,14.0,Unfurnished,46340629,domcache_srp_46340629,19.1142547770137,Powai lake,72.9002670217489,2020-01-13,Sagar,55000,Lake Pleasant," 2 BHK Apartment for Rent in Lake Pleasant, Powai lake 1000 sqft",Rent,Apartment,/propertyDetails/2-BHK-1000-Sq-ft-Multistorey-Apartment-FOR-Rent-Powai-lake-in-Mumbai&id=4d423436333430363239,Agent
21047,1000.0,2.0,2,Mumbai,"2 Bath,Unfurnished,10 floor,East facing Unfurnished 2 BHK apartment for rent in Lake Primrose, Lake Home Complex, Powai. Apartment has all modern amenities garden, swimming pool, gym, health club Community hall, Indoor games, Children park, Intercom etc. Lavish living area with big bed rooms, modular kitchen and a balcony with a powai lake view to make your mornings and evenings more memorable. Apartment is located in a dense green location. in the apartment. good security, 24 by 7 water and electricity supply. CCTV neat and clean complex Good connectivity near to schools, Hospitals and markets.",Ekta World,22.0,10.0,Unfurnished,46054069,domcache_srp_46054069,19.11382558,Powai,72.89989433,2020-01-13,Avinash  Babar,53000,Lake Primrose," 2 BHK Apartment for Rent in Lake Primrose, Powai 1000 sqft",Rent,Apartment,/propertyDetails/2-BHK-1000-Sq-ft-Multistorey-Apartment-FOR-Rent-Powai-in-Mumbai&id=4d423436303534303639,Agent
21063,1000.0,2.0,2,Mumbai,"2 Bath,Semi-Furnished,4 floor,West facing 2bhk flat available for rent in Powai  at hiranandani gardens. It is close to market of Hiranandani Gardens, Powai. It is very close to basic necessities of life like top of the schools, market, top of the doctors, Hospitals, Atm, banks etc. It has built up area of 1000sqft and carpet area of 700sqft at the rate of Rs.  60000 as rent and Rs. 3lakhs as deposit amount Negotiable.",Hiranandani Group,7.0,4.0,Semi-Furnished,46047333,domcache_srp_46047333,19.11559447,Powai,72.91224898,2020-01-13,Ameet Motwani,60000,Hiranandani Gardens," 2 BHK Apartment for Rent in Hiranandani Gardens, Powai 1000 sqft",Rent,Apartment,/propertyDetails/2-BHK-1000-Sq-ft-Multistorey-Apartment-FOR-Rent-Powai-in-Mumbai&id=4d423436303437333333,Agent
21096,1000.0,2.0,2,Mumbai,"2 Bath,Furnished,5 floor  This 2 BHK Apartment is at 5 floor and it has spacious 2 bathroom You can avail this well-designed Apartment on a monthly rent of 52000. ",Damji Shamji Shah Group,10.0,5.0,Furnished,43620579,domcache_srp_43620579,19.124657,Powai,72.892539,2019-12-12,Mohammed Sarfaraz Bhati,52000,Mahavir Classik," 2 BHK Apartment for Rent in Mahavir Classik, Powai 1000 sqft",Rent,Apartment,/propertyDetails/2-BHK-1000-Sq-ft-Multistorey-Apartment-FOR-Rent-Powai-in-Mumbai-r1&id=4d423433363230353739,Agent
21102,1000.0,2.0,2,Mumbai,"2 Bath,Unfurnished,10 floor,East facing Prime LocationHigher floorSpacious flatAll amenitiesKeys AvailableGreat viewGated communitySchools & colleges at walking distanceMalls Hospitals hotels restaurants nearby",Transcon Sheth Creators,41.0,10.0,Unfurnished,46852755,domcache_srp_46852755,19.191842,Kanch Pada,72.83458123,2019-12-21,Dhruvin  Shah,53000,Auris Serenity," 2 BHK Apartment for Rent in Auris Serenity, Kanch Pada 1000 sqft",Rent,Apartment,/propertyDetails/2-BHK-1000-Sq-ft-Multistorey-Apartment-FOR-Rent-Kanch-Pada-in-Mumbai&id=4d423436383532373535,Agent
21113,1000.0,2.0,2,Mumbai,"2 Bath,Furnished,4 floor,North - East facing Excellent  Fully Furnished 2 bhk is available for  RENT  at bhakti park wadala east , The society has all the amenities like swimming pool, Gym, Club house, Huge 27 acres garden etc. The place is very well connected to the eastern freeway & western side and close to all business destination like lower parel, Bkc, Fort,  Nariman point, Mahalaxmi, Worli , Prabhadevi , etc. Do call us for multiple options in Wadala and nearby areas",Ajmera Group,7.0,4.0,Furnished,45699161,domcache_srp_45699161,19.02935005594641,Wadala East,72.88030444699154,2020-01-10,Balwinder Singh Banga,52000,Ajmera Bhakti Park," 2 BHK Apartment for Rent in Ajmera Bhakti Park, Wadala East 1000 sqft",Rent,Apartment,/propertyDetails/2-BHK-1000-Sq-ft-Multistorey-Apartment-FOR-Rent-Wadala-East-in-Mumbai-r1&id=4d423435363939313631,Agent
21116,1000.0,2.0,2,Mumbai,"2 Bath,Semi-Furnished,8 floor,North facing Silver Arch 2 BHK apartment for rent.Located on 8th floor out of the 12 located in oshiwara.It is a semifurnished property.The property has 2 bedrooms with 2 bathrooms. Available at an expected price of rs 60000.The property comes with a good construction quality which ages 5-10 years old propertyAdditional details :The society has dedicated security guards for every tower.Full power backup is available.Daily needs shopping could be done within the society premises to make the stay convinent. The apartment has borings water supply.Piped gas facility is available in the property",D Kapoor Land Developers,12.0,8.0,Semi-Furnished,44015641,domcache_srp_44015641,19.1379646,Oshiwara,72.827219,2019-11-18,Roshan Gupta,60000,Silver Arch," 2 BHK Apartment for Rent in Silver Arch, Oshiwara 1000 sqft",Rent,Apartment,/propertyDetails/2-BHK-1000-Sq-ft-Multistorey-Apartment-FOR-Rent-Oshiwara-in-Mumbai-r1&id=4d423434303135363431,Agent
21170,1000.0,2.0,2,Mumbai,"2 Bath,Semi-Furnished,12 floor,North - East facing bhakti park s a good locality it has good connectivity to airport railway station shopping mall metro station market malls banks and atm",Ajmera Realty & Infra India Ltd.,17.0,12.0,Semi-Furnished,43284315,domcache_srp_43284315,18.686021540842198,Bhakti Park,72.79986571997841,2019-11-21,Savita,53000,Bhakti Park," 2 BHK Apartment for Rent in Bhakti Park, Bhakti Park 1000 sqft",Rent,Apartment,/propertyDetails/2-BHK-1000-Sq-ft-Multistorey-Apartment-FOR-Rent-Bhakti-Park-in-Mumbai-r1&id=4d423433323834333135,Agent
21179,1000.0,2.0,2,Mumbai,"2 Bath,Semi-Furnished,8 floor,West facing Semi furnished 2 BHK Flat for rent in Lake Pleasant Lake Home Complex with wardrobe in 1 bedroom, 2 AC, fridge, washing machine, furnished Modular Kitchen along with pipe gas connection Geyser and lightings in all rooms. Well maintained and done up flat. dry balconies to kitchen etc. very posh building and well maintained with all the modern amenities and even having a tight security with intercom facility. It has various modern amenities like Garden Swimming Pool Play Area Health Facilities, 24Hr Backup Security Intercom Club house Indoor Games etc. Available for family.",Supreme Universal,22.0,8.0,Semi-Furnished,32706473,domcache_srp_32706473,19.1142547770137,Powai,72.9002670217489,2020-01-13,Sagar,52000,Lake Pleasant," 2 BHK Apartment for Rent in Lake Pleasant, Powai 1000 sqft",Rent,Apartment,/propertyDetails/2-BHK-1000-Sq-ft-Multistorey-Apartment-FOR-Rent-Powai-in-Mumbai-r2&id=4d423332373036343733,Agent
21255,1000.0,2.0,2,Mumbai,"2 Bath,Unfurnished,4 floor,East facing 2 BHK, Multistorey Apartment is available for Rent in Santacruz East, Mumbai for 55,000",Kumar Builders,10.0,4.0,Unfurnished,46784229,domcache_srp_46784229,19.07658768,Santacruz East,72.86424255,2019-12-18,Vashdev Nagpal,55000,Kul Court," 2 BHK Apartment for Rent in Kul Court, Santacruz East 1000 sqft",Rent,Apartment,/propertyDetails/2-BHK-1000-Sq-ft-Multistorey-Apartment-FOR-Rent-Santacruz-East-in-Mumbai&id=4d423436373834323239,Agent
21259,1000.0,2.0,2,Mumbai,"2 Bath,Furnished,5 floor,East facing 2 BHK Furnished flat in Hiranandani Gardens, Powai. It is the best property of powai with world class amenities and luxuries, a heavily loaded club house with gym, Swimming pool, Lawn tennis, Jogging track, Cafeteria and many more. It has its own building 24 hours security along with CCTV vigilance and personal commando security to maintain peace. Global brands related to eateries, Shopping & it companies are all in the complex on high street. Please call to know more about this property.",Hiranandani Group,7.0,5.0,Furnished,46538511,domcache_srp_46538511,19.11559447,Powai,72.91224898,2019-12-06,Sachin Babar,60000,Hiranandani Gardens," 2 BHK Apartment for Rent in Hiranandani Gardens, Powai 1000 sqft",Rent,Apartment,/propertyDetails/2-BHK-1000-Sq-ft-Multistorey-Apartment-FOR-Rent-Powai-in-Mumbai&id=4d423436353338353131,Agent
21263,1000.0,2.0,2,Mumbai,"2 Bath,Semi-Furnished,10 floor,East facing Ready to Move in, Nicely doneup semi Furnished All modern amenities landscapes gardens children park club house pool gym",L&T Realty,24.0,10.0,Semi-Furnished,46388169,domcache_srp_46388169,19.122307,Powai,72.89599270000002,2019-12-27,Bhavesh Khetia,56000,Emerald Isle," 2 BHK Apartment for Rent in Emerald Isle, Powai 1000 sqft",Rent,Apartment,/propertyDetails/2-BHK-1000-Sq-ft-Multistorey-Apartment-FOR-Rent-Powai-in-Mumbai&id=4d423436333838313639,Agent
21270,1000.0,2.0,2,Mumbai,"2 Bath,Furnished,7 floor,East facing 2 Bhk Fully furnished in Lake Homes which is situated on Chandivali Farm Road With all amenities in the complex like Garden, Swimming Pool, Play Area, Health Facilities, Recreation Facilities, 24 Hr Backup, Maintenance Staff, Security, Intercom, Club House, Rain Water Harvesting, Wifi, Broadband Internet, Tennis Court, Badminton Court, Gymnasium, BankAtm, Community Hall etc. The apartment is fully furnished with modular kitchen, water purifier, washing machine, pipe gas, Tv, fridge, Ac, Sofa set, Cupboards, Bed, Wardrobes etc….Interested can call for further details.",Supreme Universal,22.0,7.0,Furnished,47050375,domcache_srp_47050375,19.1135524,Powai,72.8995003,2020-01-13,Avinash  Babar,55000,Lake Homes," 2 BHK Apartment for Rent in Lake Homes, Powai 1000 sqft",Rent,Apartment,/propertyDetails/2-BHK-1000-Sq-ft-Multistorey-Apartment-FOR-Rent-Powai-in-Mumbai&id=4d423437303530333735,Agent
21331,1000.0,2.0,2,Mumbai,"2 Bath,Unfurnished,4 floor,East facing 2 BHK, Multistorey Apartment is available for Rent in Santacruz East, Mumbai for 55,000",Kumar Builders,10.0,4.0,Unfurnished,46897631,domcache_srp_46897631,19.07658768,Santacruz East,72.86424255,2019-12-23,Vashdev Nagpal,55000,Kul Court," 2 BHK Apartment for Rent in Kul Court, Santacruz East 1000 sqft",Rent,Apartment,/propertyDetails/2-BHK-1000-Sq-ft-Multistorey-Apartment-FOR-Rent-Santacruz-East-in-Mumbai&id=4d423436383937363331,Agent
21336,1000.0,2.0,2,Mumbai,"2 Bath,Semi-Furnished,5 floor,North - East facing Our fees only Rs. 20,000 for an apartment in Mumbai. Professional Property Management. Multiple direct options available. There is 2bhk apartment available.",H K Pujara Builders,13.0,5.0,Semi-Furnished,46703967,domcache_srp_46703967,19.13605492,Andheri West,72.83612939,2019-12-14,Azuro,55000,Chitralekha HERRITAGE," 2 BHK Apartment for Rent in Chitralekha HERRITAGE, Andheri West 1000 sqft",Rent,Apartment,/propertyDetails/2-BHK-1000-Sq-ft-Multistorey-Apartment-FOR-Rent-Andheri-West-in-Mumbai&id=4d423436373033393637,Agent
21361,1000.0,2.0,2,Mumbai,"2 Bath,Unfurnished,5 floor,East facing Two bhk on rent in vakola santacruz east one car parking contact us for inspection and information.",Vaibhav properties,12.0,5.0,Unfurnished,46486985,domcache_srp_46486985,19.076730800000004,Santacruz East,72.85426650000002,2019-12-04,Vashdev Nagpal,55000,Vaibhav Paradise," 2 BHK Apartment for Rent in Vaibhav Paradise, Santacruz East 1000 sqft",Rent,Apartment,/propertyDetails/2-BHK-1000-Sq-ft-Multistorey-Apartment-FOR-Rent-Santacruz-East-in-Mumbai&id=4d423436343836393835,Agent
21405,1000.0,2.0,2,Mumbai,"2 Bath,Furnished,5 floor,East facing 2bhk flat available for rent , very beautifull flat Description  An excellent  2bhk residential apartment for rent in oshiwara andheri West, mumbai andheriDahisar. It is a very ... read more good property and has 2 balconys which make the apartment more spacious. In addition, it has pooja room, study room  available for all. ... Description  2 bhk apartment for rent in oshiwara, mumbai andheriDahisar. just lokhandwala market and kokilaben hospital and near metro station also,",Kohinoor Developer,10.0,5.0,Furnished,46746235,domcache_srp_46746235,19.15172033,Andheri West,72.82838209,2020-01-13,Shukla Yadav,55000,Kohinoor Apartment 1," 2 BHK Apartment for Rent in Kohinoor Apartment 1, Andheri West 1000 sqft",Rent,Apartment,/propertyDetails/2-BHK-1000-Sq-ft-Multistorey-Apartment-FOR-Rent-Andheri-West-in-Mumbai&id=4d423436373436323335,Agent
21429,1000.0,2.0,2,Mumbai,"2 Bath,Unfurnished,5 floor,East facing two bhk on rent in vakola Vaibhav paradise contact us for inspection and information",Vaibhav properties,10.0,5.0,Unfurnished,46412127,domcache_srp_46412127,19.076730800000004,Santacruz East,72.85426650000002,2019-12-01,Vashdev Nagpal,55000,Vaibhav Paradise," 2 BHK Apartment for Rent in Vaibhav Paradise, Santacruz East 1000 sqft",Rent,Apartment,/propertyDetails/2-BHK-1000-Sq-ft-Multistorey-Apartment-FOR-Rent-Santacruz-East-in-Mumbai&id=4d423436343132313237,Agent
21453,1000.0,2.0,2,Mumbai,"2 Bath,Unfurnished,5 floor,East facing Two bhk on rent in vaibhav paradise vakola santacruz east one car parking space no restrictions contact us for inspection and information.",Vaibhav properties,12.0,5.0,Unfurnished,46238149,domcache_srp_46238149,19.076730800000004,Santacruz East,72.85426650000002,2019-11-22,Vashdev Nagpal,55000,Vaibhav Paradise," 2 BHK Apartment for Rent in Vaibhav Paradise, Santacruz East 1000 sqft",Rent,Apartment,/propertyDetails/2-BHK-1000-Sq-ft-Multistorey-Apartment-FOR-Rent-Santacruz-East-in-Mumbai&id=4d423436323338313439,Agent
21472,1000.0,2.0,2,Mumbai,"2 Bath,Unfurnished,5 floor,East facing Two bhk on rent in vakola santacruz east one car parking contact us for inspection and information.",Vaibhav properties,12.0,5.0,Unfurnished,46540097,domcache_srp_46540097,19.076730800000004,Santacruz East,72.85426650000002,2019-12-06,Vashdev Nagpal,55000,Vaibhav Paradise," 2 BHK Apartment for Rent in Vaibhav Paradise, Santacruz East 1000 sqft",Rent,Apartment,/propertyDetails/2-BHK-1000-Sq-ft-Multistorey-Apartment-FOR-Rent-Santacruz-East-in-Mumbai&id=4d423436353430303937,Agent
21480,1000.0,2.0,2,Mumbai,"2 Bath,Unfurnished,5 floor,East facing Brand new two bhk on rent in kalina santacruz east contact us for inspection and information.",Kumar Builders,10.0,5.0,Unfurnished,46539929,domcache_srp_46539929,19.07658768,Santacruz East,72.86424255,2019-12-06,Vashdev Nagpal,55000,Kul Court," 2 BHK Apartment for Rent in Kul Court, Santacruz East 1000 sqft",Rent,Apartment,/propertyDetails/2-BHK-1000-Sq-ft-Multistorey-Apartment-FOR-Rent-Santacruz-East-in-Mumbai&id=4d423436353339393239,Agent
21482,1000.0,2.0,2,Mumbai,"2 Bath,Semi-Furnished,10 floor,East facing Semi Furnished  2 bhk in a prime location in Sundew at raheja vihar complex, chandivali farm road, powai, this is Semi furnished flat with Modular Kitchen, wardrobe, light, fan, etc. Very good society and very peaceful colony with club house facilities. This is well maintained complex it has all the amenities provided by raheja including the bombay scottish school may play grounds, swimming pool, gym, club house, pool. 10 minutes from hiranandani, powai. Its very close to powai lake chandivali is a peaceful, green, well managed locality with modern spacious flats. For further details, please c",Cooperative Group Housing Society,12.0,10.0,Semi-Furnished,44628563,domcache_srp_44628563,19.1197046,Chandivali,72.8936639,2020-01-12,Sachin,60000,Sundew CHS," 2 BHK Apartment for Rent in Sundew CHS, Chandivali 1000 sqft",Rent,Apartment,/propertyDetails/2-BHK-1000-Sq-ft-Multistorey-Apartment-FOR-Rent-Chandivali-in-Mumbai&id=4d423434363238353633,Agent
21489,1000.0,2.0,2,Mumbai,"2 Bath,Furnished,7 floor,East facing Fully Furnished 2 BHK Flat for Rent in Panch Complex Powai. The Flat Is Conveniently Located Near S M Shetty School Powai. This is Fully Furnished flat with modular kitchen along with pipe gas, wardrobes, fan, bed, AC,lights etc. It has various modern amenities like Garden Swimming Pool Play Area Health Facilities Recreation Facilities Maintenance Staff Security Intercom Club House Gymnasium Indoor Games Community Hall etc.",Srishti Construction,18.0,7.0,Furnished,45686527,domcache_srp_45686527,19.1139745,Powai,72.9035992,2020-01-12,Sachin,55000,Panch Complex," 2 BHK Apartment for Rent in Panch Complex, Powai 1000 sqft",Rent,Apartment,/propertyDetails/2-BHK-1000-Sq-ft-Multistorey-Apartment-FOR-Rent-Powai-in-Mumbai-r1&id=4d423435363836353237,Agent
21521,1000.0,2.0,2,Mumbai,"2 Bath,Semi-Furnished,5 floor,North facing 2 BHK flatSemi Furnishedavailable on RENT in Vasant Oasis, Marolwith Stilt Car Parkingand All World Class AmenitiesImmediate Possession3 ACs and Piped Gas AvailableFor details, please, contact us",Sheth Creators,22.0,5.0,Semi-Furnished,45363455,domcache_srp_45363455,19.114625,Andheri East,72.88409300000002,2019-12-12,Zara  Nadvi,52000,Vasant Oasis," 2 BHK Apartment for Rent in Vasant Oasis, Andheri East 1000 sqft",Rent,Apartment,/propertyDetails/2-BHK-1000-Sq-ft-Multistorey-Apartment-FOR-Rent-Andheri-East-in-Mumbai-r1&id=4d423435333633343535,Agent
